{
  "businessName": "Northwind Studio",
  "businessAddress": [
    "Office Address",
    "Main Street, Number 06/B,",
    "South Mountain, YK",
    "(+62) 123 456 7890"
  ],
  "logoUrl": "https://upload.wikimedia.org/wikipedia/commons/a/a7/React-icon.svg",
  "logoWidth": 48,
  "invoiceTitle": "INVOICE",
  "invoiceDate": "December 26, 2026",
  "billToTitle": "To :",
  "clientName": "Wagino Subianto",
  "clientAddress": ["Main Street, Your Loc.", "Number 06/B"],
  "currencySymbol": "$",
  "items": [
    { "name": "Brand identity workshop", "quantity": 1, "unitPriceCents": 2000 },
    { "name": "Landing page design", "quantity": 1, "unitPriceCents": 5000 },
    { "name": "Component library", "quantity": 1, "unitPriceCents": 3000 },
    { "name": "Prototype handoff", "quantity": 1, "unitPriceCents": 6000 }
  ],
  "note": "Lorem ipsum dolor sit amet, consectetuer adipiscing elit, sed diam nonummy nibh euismod tincidunt autem vel eum iriure dolor in hendrerit.",
  "subtotalCents": 16000,
  "discountRatePercent": 5,
  "discountCents": 1200,
  "totalCents": 14800,
  "thankYouMessage": "Thank you for your Business",
  "questionsEmail": "company@mail.site",
  "questionsPhone": "+628 123 456 709",
  "paymentAccount": "1234 567 890",
  "paymentName": "Bodat Supeno",
  "paymentBank": "Bank Pribadi",
  "terms": "Lorem ipsum dolor sit amet, consectetuer adipiscing elit, sed diam nonummy nibh euismod tincidunt."
}
